   ------------------------------------------------------------
  | Welcome to ROOT 6.02/05                http://root.cern.ch |
  |                               (c) 1995-2014, The ROOT Team |
  | Built for linuxx8664gcc                                    |
  | From tag , 9 February 2015                                 |
  | Try '.help', '.demo', '.license', '.credits', '.quit'/'.q' |
   ------------------------------------------------------------


Processing FakeInvestigation.C+...
Info in <TUnixSystem::ACLiC>: creating shared library /home/bmichlin/CMSSW_7_4_1_patch1/src/MuJetAnalysis/AnalysisRun2/scripts/ExtendFidRegion/MakeAllPlots/./FakeInvestigation_C.so
In file included from /home/bmichlin/CMSSW_7_4_1_patch1/src/MuJetAnalysis/AnalysisRun2/scripts/ExtendFidRegion/MakeAllPlots/FakeInvestigation_C_ACLiC_dict.cxx:41:0:
/home/bmichlin/CMSSW_7_4_1_patch1/src/MuJetAnalysis/AnalysisRun2/scripts/ExtendFidRegion/MakeAllPlots/./FakeInvestigation.C: In function 'void efficiency_hitrecovery(TString)':
/home/bmichlin/CMSSW_7_4_1_patch1/src/MuJetAnalysis/AnalysisRun2/scripts/ExtendFidRegion/MakeAllPlots/./FakeInvestigation.C:970:23: warning: comparison between signed and unsigned integer expressions [-Wsign-compare]
      for(int r = 0; r < reco_real_muons_phi.size(); r++){
                       ^
/home/bmichlin/CMSSW_7_4_1_patch1/src/MuJetAnalysis/AnalysisRun2/scripts/ExtendFidRegion/MakeAllPlots/./FakeInvestigation.C:986:21: warning: comparison between signed and unsigned integer expressions [-Wsign-compare]
     for(int i = 0; i< dR_real_g_r_real.size(); i++){
                     ^
/home/bmichlin/CMSSW_7_4_1_patch1/src/MuJetAnalysis/AnalysisRun2/scripts/ExtendFidRegion/MakeAllPlots/./FakeInvestigation.C:1007:21: warning: comparison between signed and unsigned integer expressions [-Wsign-compare]
     for(int i = 0; i< dR_real_g_r_real.size(); i++){
                     ^
/home/bmichlin/CMSSW_7_4_1_patch1/src/MuJetAnalysis/AnalysisRun2/scripts/ExtendFidRegion/MakeAllPlots/./FakeInvestigation.C:1030:21: warning: comparison between signed and unsigned integer expressions [-Wsign-compare]
     for(int i = 0; i< dR_real_g_r_real.size(); i++){
                     ^
/home/bmichlin/CMSSW_7_4_1_patch1/src/MuJetAnalysis/AnalysisRun2/scripts/ExtendFidRegion/MakeAllPlots/./FakeInvestigation.C:1053:21: warning: comparison between signed and unsigned integer expressions [-Wsign-compare]
     for(int i = 0; i< dR_real_g_r_real.size(); i++){
                     ^
In file included from /home/bmichlin/CMSSW_7_4_1_patch1/src/MuJetAnalysis/AnalysisRun2/scripts/ExtendFidRegion/MakeAllPlots/FakeInvestigation_C_ACLiC_dict.cxx:41:0:
/home/bmichlin/CMSSW_7_4_1_patch1/src/MuJetAnalysis/AnalysisRun2/scripts/ExtendFidRegion/MakeAllPlots/./FakeInvestigation.C:1101:23: warning: comparison between signed and unsigned integer expressions [-Wsign-compare]
      for(int r = 0; r < reco_real_muons_phi.size(); r++){ //Find best real_match to diMuonC
                       ^
/home/bmichlin/CMSSW_7_4_1_patch1/src/MuJetAnalysis/AnalysisRun2/scripts/ExtendFidRegion/MakeAllPlots/./FakeInvestigation.C:1113:23: warning: comparison between signed and unsigned integer expressions [-Wsign-compare]
      for(int r = 0; r < reco_real_muons_phi.size(); r++){ //Find Second_real best real_match to diMuonC
                       ^
/home/bmichlin/CMSSW_7_4_1_patch1/src/MuJetAnalysis/AnalysisRun2/scripts/ExtendFidRegion/MakeAllPlots/./FakeInvestigation.C:1129:23: warning: comparison between signed and unsigned integer expressions [-Wsign-compare]
      for(int r = 0; r < reco_real_muons_phi.size(); r++){ //Find best real_match to diMuonF
                       ^
/home/bmichlin/CMSSW_7_4_1_patch1/src/MuJetAnalysis/AnalysisRun2/scripts/ExtendFidRegion/MakeAllPlots/./FakeInvestigation.C:1141:23: warning: comparison between signed and unsigned integer expressions [-Wsign-compare]
      for(int r = 0; r < reco_real_muons_phi.size(); r++){ //Find Second_real best real_match to diMuonF
                       ^
/home/bmichlin/CMSSW_7_4_1_patch1/src/MuJetAnalysis/AnalysisRun2/scripts/ExtendFidRegion/MakeAllPlots/./FakeInvestigation.C:1485:24: warning: comparison between signed and unsigned integer expressions [-Wsign-compare]
       for(int r = 0; r < reco_muons_phi.size(); r++){
                        ^
/home/bmichlin/CMSSW_7_4_1_patch1/src/MuJetAnalysis/AnalysisRun2/scripts/ExtendFidRegion/MakeAllPlots/./FakeInvestigation.C:1523:24: warning: comparison between signed and unsigned integer expressions [-Wsign-compare]
       for(int r = 0; r < reco_muons_phi.size(); r++){
                        ^
/home/bmichlin/CMSSW_7_4_1_patch1/src/MuJetAnalysis/AnalysisRun2/scripts/ExtendFidRegion/MakeAllPlots/./FakeInvestigation.C:1546:22: warning: comparison between signed and unsigned integer expressions [-Wsign-compare]
      for(int i = 0; i< dR_g_r.size(); i++){
                      ^
/home/bmichlin/CMSSW_7_4_1_patch1/src/MuJetAnalysis/AnalysisRun2/scripts/ExtendFidRegion/MakeAllPlots/./FakeInvestigation.C:1567:22: warning: comparison between signed and unsigned integer expressions [-Wsign-compare]
      for(int i = 0; i< dR_g_r.size(); i++){
                      ^
/home/bmichlin/CMSSW_7_4_1_patch1/src/MuJetAnalysis/AnalysisRun2/scripts/ExtendFidRegion/MakeAllPlots/./FakeInvestigation.C:1590:22: warning: comparison between signed and unsigned integer expressions [-Wsign-compare]
      for(int i = 0; i< dR_g_r.size(); i++){
                      ^
/home/bmichlin/CMSSW_7_4_1_patch1/src/MuJetAnalysis/AnalysisRun2/scripts/ExtendFidRegion/MakeAllPlots/./FakeInvestigation.C:1613:22: warning: comparison between signed and unsigned integer expressions [-Wsign-compare]
      for(int i = 0; i< dR_g_r.size(); i++){
                      ^
/home/bmichlin/CMSSW_7_4_1_patch1/src/MuJetAnalysis/AnalysisRun2/scripts/ExtendFidRegion/MakeAllPlots/./FakeInvestigation.C:1661:24: warning: comparison between signed and unsigned integer expressions [-Wsign-compare]
       for(int r = 0; r < reco_muons_phi.size(); r++){ //Find best match to diMuonC
                        ^
/home/bmichlin/CMSSW_7_4_1_patch1/src/MuJetAnalysis/AnalysisRun2/scripts/ExtendFidRegion/MakeAllPlots/./FakeInvestigation.C:1673:24: warning: comparison between signed and unsigned integer expressions [-Wsign-compare]
       for(int r = 0; r < reco_muons_phi.size(); r++){ //Find second best match to diMuonC
                        ^
/home/bmichlin/CMSSW_7_4_1_patch1/src/MuJetAnalysis/AnalysisRun2/scripts/ExtendFidRegion/MakeAllPlots/./FakeInvestigation.C:1689:24: warning: comparison between signed and unsigned integer expressions [-Wsign-compare]
       for(int r = 0; r < reco_muons_phi.size(); r++){ //Find best match to diMuonF
                        ^
/home/bmichlin/CMSSW_7_4_1_patch1/src/MuJetAnalysis/AnalysisRun2/scripts/ExtendFidRegion/MakeAllPlots/./FakeInvestigation.C:1701:24: warning: comparison between signed and unsigned integer expressions [-Wsign-compare]
       for(int r = 0; r < reco_muons_phi.size(); r++){ //Find second best match to diMuonF
                        ^
/home/bmichlin/CMSSW_7_4_1_patch1/src/MuJetAnalysis/AnalysisRun2/scripts/ExtendFidRegion/MakeAllPlots/./FakeInvestigation.C: In function 'void makePlot()':
/home/bmichlin/CMSSW_7_4_1_patch1/src/MuJetAnalysis/AnalysisRun2/scripts/ExtendFidRegion/MakeAllPlots/./FakeInvestigation.C:2463:17: warning: comparison between signed and unsigned integer expressions [-Wsign-compare]
  for(int i=0; i < mGammaD_0250_cT.size(); i++){
                 ^
/home/bmichlin/CMSSW_7_4_1_patch1/src/MuJetAnalysis/AnalysisRun2/scripts/ExtendFidRegion/MakeAllPlots/./FakeInvestigation.C:2475:17: warning: comparison between signed and unsigned integer expressions [-Wsign-compare]
  for(int i=0; i < mGammaD_0275_cT.size(); i++){
                 ^
/home/bmichlin/CMSSW_7_4_1_patch1/src/MuJetAnalysis/AnalysisRun2/scripts/ExtendFidRegion/MakeAllPlots/./FakeInvestigation.C:2487:17: warning: comparison between signed and unsigned integer expressions [-Wsign-compare]
  for(int i=0; i < mGammaD_0300_cT.size(); i++){
                 ^
/home/bmichlin/CMSSW_7_4_1_patch1/src/MuJetAnalysis/AnalysisRun2/scripts/ExtendFidRegion/MakeAllPlots/./FakeInvestigation.C:2499:17: warning: comparison between signed and unsigned integer expressions [-Wsign-compare]
  for(int i=0; i < mGammaD_2000_cT.size(); i++){
                 ^
/home/bmichlin/CMSSW_7_4_1_patch1/src/MuJetAnalysis/AnalysisRun2/scripts/ExtendFidRegion/MakeAllPlots/./FakeInvestigation.C:2510:17: warning: comparison between signed and unsigned integer expressions [-Wsign-compare]
  for(int i=0; i < mGammaD_8500_cT.size(); i++){
                 ^
/home/bmichlin/CMSSW_7_4_1_patch1/src/MuJetAnalysis/AnalysisRun2/scripts/ExtendFidRegion/MakeAllPlots/./FakeInvestigation.C:2522:17: warning: comparison between signed and unsigned integer expressions [-Wsign-compare]
  for(int i=0; i < mGammaD_0400_cT.size(); i++){
                 ^
/home/bmichlin/CMSSW_7_4_1_patch1/src/MuJetAnalysis/AnalysisRun2/scripts/ExtendFidRegion/MakeAllPlots/./FakeInvestigation.C:2534:17: warning: comparison between signed and unsigned integer expressions [-Wsign-compare]
  for(int i=0; i < mGammaD_0700_cT.size(); i++){
                 ^
/home/bmichlin/CMSSW_7_4_1_patch1/src/MuJetAnalysis/AnalysisRun2/scripts/ExtendFidRegion/MakeAllPlots/./FakeInvestigation.C:2546:17: warning: comparison between signed and unsigned integer expressions [-Wsign-compare]
  for(int i=0; i < mGammaD_1000_cT.size(); i++){
                 ^
/home/bmichlin/CMSSW_7_4_1_patch1/src/MuJetAnalysis/AnalysisRun2/scripts/ExtendFidRegion/MakeAllPlots/./FakeInvestigation.C:2558:17: warning: comparison between signed and unsigned integer expressions [-Wsign-compare]
  for(int i=0; i < mGammaD_1500_cT.size(); i++){
                 ^
/home/bmichlin/CMSSW_7_4_1_patch1/src/MuJetAnalysis/AnalysisRun2/scripts/ExtendFidRegion/MakeAllPlots/./FakeInvestigation.C: In function 'void printFakeStats()':
/home/bmichlin/CMSSW_7_4_1_patch1/src/MuJetAnalysis/AnalysisRun2/scripts/ExtendFidRegion/MakeAllPlots/./FakeInvestigation.C:3303:19: warning: comparison between signed and unsigned integer expressions [-Wsign-compare]
  for(int i = 0; i < FakeStatistics.size(); i++){
                   ^
/home/bmichlin/CMSSW_7_4_1_patch1/src/MuJetAnalysis/AnalysisRun2/scripts/ExtendFidRegion/MakeAllPlots/./FakeInvestigation.C: In function 'void efficiency_hitrecovery(TString)':
/home/bmichlin/CMSSW_7_4_1_patch1/src/MuJetAnalysis/AnalysisRun2/scripts/ExtendFidRegion/MakeAllPlots/./FakeInvestigation.C:1616:169: warning: 'Third' may be used uninitialized in this function [-Wmaybe-uninitialized]
        if(dR_g_r[First][1] != dR_g_r[i][1] && dR_g_r[First][2] != dR_g_r[i][2] && dR_g_r[Second][1] != dR_g_r[i][1] && dR_g_r[Second][2] != dR_g_r[i][2] && dR_g_r[Third][1] != dR_g_r[i][1] && dR_g_r[Third][2] != dR_g_r[i][2]){
                                                                                                                                                                         ^
/home/bmichlin/CMSSW_7_4_1_patch1/src/MuJetAnalysis/AnalysisRun2/scripts/ExtendFidRegion/MakeAllPlots/./FakeInvestigation.C:1616:96: warning: 'Second' may be used uninitialized in this function [-Wmaybe-uninitialized]
        if(dR_g_r[First][1] != dR_g_r[i][1] && dR_g_r[First][2] != dR_g_r[i][2] && dR_g_r[Second][1] != dR_g_r[i][1] && dR_g_r[Second][2] != dR_g_r[i][2] && dR_g_r[Third][1] != dR_g_r[i][1] && dR_g_r[Third][2] != dR_g_r[i][2]){
                                                                                                ^
/home/bmichlin/CMSSW_7_4_1_patch1/src/MuJetAnalysis/AnalysisRun2/scripts/ExtendFidRegion/MakeAllPlots/./FakeInvestigation.C:1570:23: warning: 'First' may be used uninitialized in this function [-Wmaybe-uninitialized]
        if(dR_g_r[First][1] != dR_g_r[i][1] && dR_g_r[First][2] != dR_g_r[i][2]){ //make sure that the second best match isn't the same RECO or GEN particles
                       ^
/home/bmichlin/CMSSW_7_4_1_patch1/src/MuJetAnalysis/AnalysisRun2/scripts/ExtendFidRegion/MakeAllPlots/./FakeInvestigation.C:1056:283: warning: 'Third_real' may be used uninitialized in this function [-Wmaybe-uninitialized]
       if(dR_real_g_r_real[First_real][1] != dR_real_g_r_real[i][1] && dR_real_g_r_real[First_real][2] != dR_real_g_r_real[i][2] && dR_real_g_r_real[Second_real][1] != dR_real_g_r_real[i][1] && dR_real_g_r_real[Second_real][2] != dR_real_g_r_real[i][2] && dR_real_g_r_real[Third_real][1] != dR_real_g_r_real[i][1] && dR_real_g_r_real[Third_real][2] != dR_real_g_r_real[i][2]){
                                                                                                                                                                                                                                                                                           ^
In file included from /home/bmichlin/CMSSW_7_4_1_patch1/src/MuJetAnalysis/AnalysisRun2/scripts/ExtendFidRegion/MakeAllPlots/FakeInvestigation_C_ACLiC_dict.cxx:41:0:
/home/bmichlin/CMSSW_7_4_1_patch1/src/MuJetAnalysis/AnalysisRun2/scripts/ExtendFidRegion/MakeAllPlots/./FakeInvestigation.C:1056:160: warning: 'Second_real' may be used uninitialized in this function [-Wmaybe-uninitialized]
       if(dR_real_g_r_real[First_real][1] != dR_real_g_r_real[i][1] && dR_real_g_r_real[First_real][2] != dR_real_g_r_real[i][2] && dR_real_g_r_real[Second_real][1] != dR_real_g_r_real[i][1] && dR_real_g_r_real[Second_real][2] != dR_real_g_r_real[i][2] && dR_real_g_r_real[Third_real][1] != dR_real_g_r_real[i][1] && dR_real_g_r_real[Third_real][2] != dR_real_g_r_real[i][2]){
                                                                                                                                                                ^
/home/bmichlin/CMSSW_7_4_1_patch1/src/MuJetAnalysis/AnalysisRun2/scripts/ExtendFidRegion/MakeAllPlots/./FakeInvestigation.C:1010:37: warning: 'First_real' may be used uninitialized in this function [-Wmaybe-uninitialized]
       if(dR_real_g_r_real[First_real][1] != dR_real_g_r_real[i][1] && dR_real_g_r_real[First_real][2] != dR_real_g_r_real[i][2]){ //make sure that the Second_real best real_match isn't the same RECO or GEN particles
                                     ^
Begin Fake Investigation
There is a problem with no duplicate real_matching
There is a problem with no duplicate real_matching
There is a problem with no duplicate real_matching
There is a problem with no duplicate real_matching
There is a problem with no duplicate real_matching
There is a problem with no duplicate real_matching
There is a problem with no duplicate real_matching
There is a problem with no duplicate real_matching
There is a problem with no duplicate real_matching
There is a problem with no duplicate real_matching
There is a problem with no duplicate real_matching
There is a problem with no duplicate real_matching
There is a problem with no duplicate real_matching
There is a problem with no duplicate real_matching
There is a problem with no duplicate real_matching
There is a problem with no duplicate real_matching
There is a problem with no duplicate real_matching
There is a problem with no duplicate real_matching
There is a problem with no duplicate real_matching
There is a problem with no duplicate real_matching
There is a problem with no duplicate real_matching
There is a problem with no duplicate real_matching
There is a problem with no duplicate real_matching
There is a problem with no duplicate real_matching
There is a problem with no duplicate real_matching
There is a problem with no duplicate real_matching
There is a problem with no duplicate real_matching
There is a problem with no duplicate real_matching
There is a problem with no duplicate real_matching
There is a problem with no duplicate real_matching
There is a problem with no duplicate real_matching
There is a problem with no duplicate real_matching
There is a problem with no duplicate real_matching
There is a problem with no duplicate real_matching
There is a problem with no duplicate real_matching
There is a problem with no duplicate real_matching
There is a problem with no duplicate real_matching

 Sample: /fdata/hepx/store/user/bmichlin/DarkSUSY_mH_125_mGammaD_0250_cT_000_Evt_80k_13TeV_MG452_BR224_LHE_pythia8_GEN_SIM_MCRUN2_71_V1_v1/DarkSUSY_mH_125_mGammaD_0250_cT_000_Evt_80k_PATANA_APL_v12/160311_152439/Combined/
 Events          149500
 ================ GEN MUONS ========================================= 
 1GenMu17                       48209   reff 0.322468
 2GenMu8                        47173   reff  0.97851
 3GenMu8                        31463   reff  0.666971
 4GenMu8                        21140   reff  0.6719
 4GenMu8 Lxy/Lz                 21140   reff   1
 ================ RECO MUONS ========================================= 
 1RecMu17                       47954  reff  0.320763
 2RecMu8                        46238  reff  0.964216
 3RecMu8                        30821  reff  0.666573
 4RecMu8                        19208  reff  0.623211
 ================ EVENT variables ================= 
 Events with VtxOK              19208    reff  1
 Events with 2 muonjets         18743     reff  0.975791
 Events with 2 Dimuons          18740    reff  0.99984
 Events with 2DimVtxOK          18652    reff  0.995304
 Events with 2DimHitPix         18625     reff  0.998552
 Events with 2DimDzOK           18592   reff   0.998228
 Events with 2DimMassOK         18561  reff   0.998333
 Events with 2DimIsoOK          14953   reff   0.805614
 Events with 2DimHLT            14466   reff   0.967431
 ratio reco/gen                 0.684295 +/-  0.00319676
Fake rate (#Fakes/#Events): 0
Filling fake stat vector: 
cT_string, cT_double    : 000_, 0
mass_string, mass_double: 0250, 0.25
ev_all                  : 149500
numFakes                : 0
There is a problem with no duplicate real_matching
There is a problem with no duplicate real_matching
There is a problem with no duplicate real_matching
There is a problem with no duplicate real_matching
There is a problem with no duplicate real_matching
There is a problem with no duplicate real_matching
There is a problem with no duplicate real_matching
There is a problem with no duplicate real_matching
There is a problem with no duplicate real_matching
There is a problem with no duplicate real_matching
There is a problem with no duplicate real_matching
There is a problem with no duplicate real_matching
There is a problem with no duplicate real_matching
There is a problem with no duplicate real_matching
There is a problem with no duplicate real_matching
There is a problem with no duplicate real_matching
There is a problem with no duplicate real_matching
There is a problem with no duplicate real_matching
There is a problem with no duplicate real_matching
There is a problem with no duplicate real_matching
There is a problem with no duplicate real_matching
There is a problem with no duplicate real_matching
There is a problem with no duplicate real_matching
There is a problem with no duplicate real_matching
There is a problem with no duplicate real_matching
There is a problem with no duplicate real_matching

 Sample: /fdata/hepx/store/user/bmichlin/DarkSUSY_mH_125_mGammaD_0250_cT_005_Evt_80k_13TeV_MG452_BR224_LHE_pythia8_GEN_SIM_MCRUN2_71_V1_v1/DarkSUSY_mH_125_mGammaD_0250_cT_005_Evt_80k_PATANA_APL_v12/160311_152551/Combined/
 Events          147250
 ================ GEN MUONS ========================================= 
 1GenMu17                       47520   reff 0.322716
 2GenMu8                        46449   reff  0.977462
 3GenMu8                        30934   reff  0.665978
 4GenMu8                        20799   reff  0.672367
 4GenMu8 Lxy/Lz                 20721   reff   0
 ================ RECO MUONS ========================================= 
 1RecMu17                       47163  reff  0.320292
 2RecMu8                        45262  reff  0.959693
 3RecMu8                        30112  reff  0.665282
 4RecMu8                        18485  reff  0.613875
 ================ EVENT variables ================= 
 Events with VtxOK              18485    reff  1
 Events with 2 muonjets         17948     reff  0.970949
 Events with 2 Dimuons          17942    reff  0.999666
 Events with 2DimVtxOK          17840    reff  0.994315
 Events with 2DimHitPix         17785     reff  0.996917
 Events with 2DimDzOK           17742   reff   0.997582
 Events with 2DimMassOK         17708  reff   0.998084
 Events with 2DimIsoOK          14274   reff   0.806076
 Events with 2DimHLT            13733   reff   0.962099
 ratio reco/gen                 0.662758 +/-  0.0032843
Fake rate (#Fakes/#Events): 0
Filling fake stat vector: 
cT_string, cT_double    : 005_, 0.05
mass_string, mass_double: 0250, 0.25
ev_all                  : 147250
numFakes                : 0
There is a problem matching (dimuon 0)
There is a problem matching (dimuon 0)
There is a problem with no duplicate real_matching
There is a problem with no duplicate real_matching
There is a problem with no duplicate real_matching
There is a problem with no duplicate real_matching
There is a problem with no duplicate real_matching
There is a problem with no duplicate real_matching
There is a problem with no duplicate real_matching
There is a problem with no duplicate real_matching
There is a problem with no duplicate real_matching
There is a problem with no duplicate real_matching
There is a problem with no duplicate real_matching
There is a problem with no duplicate real_matching
There is a problem with no duplicate real_matching
There is a problem with no duplicate real_matching
There is a problem with no duplicate real_matching
There is a problem with no duplicate real_matching
There is a problem with no duplicate real_matching
There is a problem with no duplicate real_matching
There is a problem with no duplicate real_matching
There is a problem with no duplicate real_matching
There is a problem with no duplicate real_matching
There is a problem with no duplicate real_matching
There is a problem with no duplicate real_matching
There is a problem with no duplicate real_matching
There is a problem with no duplicate real_matching
There is a problem with no duplicate real_matching
There is a problem with no duplicate real_matching
There is a problem matching (dimuon 0)
There is a problem with no duplicate real_matching
There is a problem with no duplicate real_matching
There is a problem with no duplicate real_matching
There is a problem with no duplicate real_matching
There is a problem with no duplicate real_matching
There is a problem with no duplicate real_matching
There is a problem matching (dimuon 0)
There is a problem with no duplicate real_matching

 Sample: /fdata/hepx/store/user/bmichlin/DarkSUSY_mH_125_mGammaD_0250_cT_010_Evt_80k_13TeV_MG452_BR224_LHE_pythia8_GEN_SIM_MCRUN2_71_V1_v1/DarkSUSY_mH_125_mGammaD_0250_cT_010_Evt_80k_PATANA_APL_v12/160311_152700/Combined/
 Events          143250
 ================ GEN MUONS ========================================= 
 1GenMu17                       46090   reff 0.321745
 2GenMu8                        45090   reff  0.978303
 3GenMu8                        30157   reff  0.668818
 4GenMu8                        20140   reff  0.667838
 4GenMu8 Lxy/Lz                 19585   reff   0
 ================ RECO MUONS ========================================= 
 1RecMu17                       45695  reff  0.318988
 2RecMu8                        43735  reff  0.957107
 3RecMu8                        29176  reff  0.667109
 4RecMu8                        17670  reff  0.605635
 ================ EVENT variables ================= 
 Events with VtxOK              17670    reff  1
 Events with 2 muonjets         17108     reff  0.968195
 Events with 2 Dimuons          17108    reff  1
 Events with 2DimVtxOK          17003    reff  0.993863
 Events with 2DimHitPix         16642     reff  0.978768
 Events with 2DimDzOK           16587   reff   0.996695
 Events with 2DimMassOK         16556  reff   0.998131
 Events with 2DimIsoOK          13304   reff   0.803576
 Events with 2DimHLT            12822   reff   0.96377
 ratio reco/gen                 0.654685 +/-  0.00339752
Fake rate (#Fakes/#Events): 4.886561955e-05
Filling fake stat vector: 
cT_string, cT_double    : 010_, 0.1
mass_string, mass_double: 0250, 0.25
ev_all                  : 143250
numFakes                : 7
There is a problem with no duplicate real_matching
There is a problem with no duplicate real_matching
There is a problem with no duplicate real_matching
There is a problem with no duplicate real_matching
There is a problem matching (dimuon 0)
There is a problem with no duplicate real_matching
There is a problem with no duplicate real_matching
There is a problem with no duplicate real_matching
There is a problem with no duplicate real_matching
There is a problem with no duplicate real_matching
There is a problem matching (dimuon 0)
There is a problem with no duplicate real_matching
There is a problem with no duplicate real_matching
There is a problem with no duplicate real_matching
There is a problem with no duplicate real_matching
There is a problem matching (dimuon 0)
There is a problem with no duplicate real_matching
There is a problem matching (dimuon 0)
There is a problem with no duplicate real_matching
There is a problem with no duplicate real_matching
There is a problem matching (dimuon 0)
There is a problem with no duplicate real_matching
There is a problem with no duplicate real_matching
There is a problem with no duplicate real_matching
There is a problem with no duplicate real_matching
There is a problem matching (dimuon 0)
There is a problem with no duplicate real_matching
There is a problem with no duplicate real_matching
There is a problem matching (dimuon 0)
There is a problem matching (dimuon 0)
There is a problem with no duplicate real_matching
There is a problem with no duplicate real_matching
There is a problem with no duplicate real_matching
There is a problem matching (dimuon 0)
There is a problem with no duplicate real_matching
There is a problem with no duplicate real_matching
There is a problem with no duplicate real_matching

 Sample: /fdata/hepx/store/user/bmichlin/DarkSUSY_mH_125_mGammaD_0250_cT_020_Evt_80k_13TeV_MG452_BR224_LHE_pythia8_GEN_SIM_MCRUN2_71_V1_v1/DarkSUSY_mH_125_mGammaD_0250_cT_020_Evt_80k_PATANA_APL_v12/160311_152808/Combined/
 Events          151500
 ================ GEN MUONS ========================================= 
 1GenMu17                       48830   reff 0.322310231
 2GenMu8                        47775   reff  0.9783944297
 3GenMu8                        31887   reff  0.6674411303
 4GenMu8                        21247   reff  0.6663216985
 4GenMu8 Lxy/Lz                 18297   reff   0
 ================ RECO MUONS ========================================= 
 1RecMu17                       48249  reff  0.3184752475
 2RecMu8                        45980  reff  0.9529731186
 3RecMu8                        30468  reff  0.6626359287
 4RecMu8                        18003  reff  0.5908822371
 ================ EVENT variables ================= 
 Events with VtxOK              18003    reff  1
 Events with 2 muonjets         17044     reff  0.9467311004
 Events with 2 Dimuons          17039    reff  0.9997066416
 Events with 2DimVtxOK          16904    reff  0.9920769998
 Events with 2DimHitPix         15177     reff  0.897834832
 Events with 2DimDzOK           15116   reff   0.9959807604
 Events with 2DimMassOK         15099  reff   0.9988753639
 Events with 2DimIsoOK          12137   reff   0.8038280681
 Events with 2DimHLT            11644   reff   0.959380407
 ratio reco/gen                 0.636388479 +/-  0.003556231529
Fake rate (#Fakes/#Events): 0.0001254125413
Filling fake stat vector: 
cT_string, cT_double    : 020_, 0.2
mass_string, mass_double: 0250, 0.25
ev_all                  : 151500
numFakes                : 19
There is a problem matching (dimuon 0)
There is a problem matching (dimuon 0)
There is a problem with no duplicate real_matching
There is a problem with no duplicate real_matching
There is a problem with no duplicate real_matching
There is a problem with no duplicate real_matching
There is a problem matching (dimuon 0)
There is a problem matching (dimuon 0)
There is a problem with no duplicate real_matching
There is a problem with no duplicate real_matching
There is a problem with no duplicate real_matching
There is a problem matching (dimuon 0)
There is a problem matching (dimuon 0)
There is a problem with no duplicate real_matching
There is a problem matching (dimuon 0)
There is a problem matching (dimuon 0)
There is a problem matching (dimuon 0)
There is a problem matching (dimuon 0)
There is a problem matching (dimuon 0)
There is a problem matching (dimuon 0)
There is a problem with no duplicate real_matching
There is a problem matching (dimuon 0)
There is a problem matching (dimuon 0)
There is a problem matching (dimuon 0)
There is a problem matching (dimuon 0)
There is a problem with no duplicate real_matching
There is a problem with no duplicate real_matching
There is a problem matching (dimuon 0)
There is a problem matching (dimuon 0)
There is a problem matching (dimuon 0)
There is a problem matching (dimuon 0)
There is a problem matching (dimuon 0)
There is a problem with no duplicate real_matching
There is a problem matching (dimuon 0)
There is a problem with no duplicate real_matching
There is a problem matching (dimuon 0)
There is a problem with no duplicate real_matching
There is a problem with no duplicate real_matching
There is a problem matching (dimuon 0)
There is a problem matching (dimuon 0)
There is a problem matching (dimuon 0)
There is a problem with no duplicate real_matching
There is a problem matching (dimuon 0)
There is a problem matching (dimuon 0)
There is a problem matching (dimuon 0)
There is a problem matching (dimuon 0)
There is a problem matching (dimuon 0)
There is a problem matching (dimuon 0)
There is a problem matching (dimuon 0)
There is a problem with no duplicate real_matching
There is a problem matching (dimuon 0)

 Sample: /fdata/hepx/store/user/bmichlin/DarkSUSY_mH_125_mGammaD_0250_cT_050_Evt_80k_13TeV_MG452_BR224_LHE_pythia8_GEN_SIM_MCRUN2_71_V1_v1/DarkSUSY_mH_125_mGammaD_0250_cT_050_Evt_80k_PATANA_APL_v12/160311_152916/Combined/
 Events          151250
 ================ GEN MUONS ========================================= 
 1GenMu17                       48598   reff 0.3213090909
 2GenMu8                        47532   reff  0.9780649409
 3GenMu8                        31757   reff  0.6681183203
 4GenMu8                        21243   reff  0.668923387
 4GenMu8 Lxy/Lz                 10215   reff   0
 ================ RECO MUONS ========================================= 
 1RecMu17                       47345  reff  0.3130247934
 2RecMu8                        44345  reff  0.9366353364
 3RecMu8                        28983  reff  0.653579885
 4RecMu8                        15772  reff  0.5441810717
 ================ EVENT variables ================= 
 Events with VtxOK              15772    reff  1
 Events with 2 muonjets         13652     reff  0.8655845803
 Events with 2 Dimuons          13649    reff  0.999780252
 Events with 2DimVtxOK          13560    reff  0.9934793758
 Events with 2DimHitPix         8342     reff  0.6151917404
 Events with 2DimDzOK           8232   reff   0.9868137137
 Events with 2DimMassOK         8224  reff   0.9990281827
 Events with 2DimIsoOK          6619   reff   0.8048394942
 Events with 2DimHLT            6277   reff   0.9483305635
 ratio reco/gen                 0.6144884973 +/-  0.004815666065
Fake rate (#Fakes/#Events): 0.0004561983471
Filling fake stat vector: 
cT_string, cT_double    : 050_, 0.5
mass_string, mass_double: 0250, 0.25
ev_all                  : 151250
numFakes                : 69
There is a problem matching (dimuon 0)
There is a problem matching (dimuon 0)
There is a problem matching (dimuon 0)
There is a problem matching (dimuon 0)
There is a problem matching (dimuon 0)
There is a problem with no duplicate real_matching
There is a problem with no duplicate real_matching
There is a problem matching (dimuon 0)
There is a problem matching (dimuon 0)
There is a problem matching (dimuon 0)
There is a problem matching (dimuon 0)
There is a problem with no duplicate real_matching
There is a problem matching (dimuon 0)
There is a problem matching (dimuon 0)
There is a problem matching (dimuon 0)
There is a problem matching (dimuon 0)
There is a problem matching (dimuon 0)
There is a problem matching (dimuon 0)
There is a problem matching (dimuon 0)
There is a problem matching (dimuon 0)
There is a problem matching (dimuon 0)
There is a problem matching (dimuon 0)
There is a problem matching (dimuon 0)
There is a problem matching (dimuon 0)
There is a problem with no duplicate real_matching
There is a problem matching (dimuon 0)
There is a problem matching (dimuon 0)
There is a problem matching (dimuon 0)
There is a problem with no duplicate real_matching
There is a problem matching (dimuon 0)
There is a problem matching (dimuon 0)
There is a problem matching (dimuon 0)
There is a problem matching (dimuon 0)
There is a problem matching (dimuon 0)

 Sample: /fdata/hepx/store/user/bmichlin/DarkSUSY_mH_125_mGammaD_0250_cT_100_Evt_80k_13TeV_MG452_BR224_LHE_pythia8_GEN_SIM_MCRUN2_71_V1_v1/DarkSUSY_mH_125_mGammaD_0250_cT_100_Evt_80k_PATANA_APL_v12/160311_153323/Combined/
 Events          148750
 ================ GEN MUONS ========================================= 
 1GenMu17                       48032   reff 0.3229042017
 2GenMu8                        46959   reff  0.9776607262
 3GenMu8                        31251   reff  0.6654954322
 4GenMu8                        20870   reff  0.6678186298
 4GenMu8 Lxy/Lz                 4491   reff   0
 ================ RECO MUONS ========================================= 
 1RecMu17                       44082  reff  0.2963495798
 2RecMu8                        40118  reff  0.9100766753
 3RecMu8                        24800  reff  0.6181763797
 4RecMu8                        12019  reff  0.4846370968
 ================ EVENT variables ================= 
 Events with VtxOK              12019    reff  1
 Events with 2 muonjets         9383     reff  0.7806805891
 Events with 2 Dimuons          9381    reff  0.9997868486
 Events with 2DimVtxOK          9314    reff  0.9928579043
 Events with 2DimHitPix         3703     reff  0.3975735452
 Events with 2DimDzOK           3601   reff   0.9724547664
 Events with 2DimMassOK         3598  reff   0.9991668981
 Events with 2DimIsoOK          2898   reff   0.8054474708
 Events with 2DimHLT            2727   reff   0.9409937888
 ratio reco/gen                 0.6072144289 +/-  0.007287478337
Fake rate (#Fakes/#Events): 0.0003226890756
Filling fake stat vector: 
cT_string, cT_double    : 100_, 1
mass_string, mass_double: 0250, 0.25
ev_all                  : 148750
numFakes                : 48
There is a problem with no duplicate real_matching
There is a problem with no duplicate real_matching
There is a problem matching (dimuon 0)
There is a problem matching (dimuon 0)
There is a problem matching (dimuon 0)
There is a problem matching (dimuon 0)
There is a problem matching (dimuon 0)
There is a problem matching (dimuon 0)
There is a problem matching (dimuon 0)

 Sample: /fdata/hepx/store/user/bmichlin/DarkSUSY_mH_125_mGammaD_0250_cT_200_Evt_80k_13TeV_MG452_BR224_LHE_pythia8_GEN_SIM_MCRUN2_71_V1_v1/DarkSUSY_mH_125_mGammaD_0250_cT_200_Evt_80k_PATANA_APL_v12/160311_153723/Combined/
 Events          147750
 ================ GEN MUONS ========================================= 
 1GenMu17                       47472   reff 0.3212994924
 2GenMu8                        46443   reff  0.9783240647
 3GenMu8                        30999   reff  0.6674633422
 4GenMu8                        20916   reff  0.6747314429
 4GenMu8 Lxy/Lz                 1562   reff   0
 ================ RECO MUONS ========================================= 
 1RecMu17                       36796  reff  0.2490423012
 2RecMu8                        31828  reff  0.8649853245
 3RecMu8                        17313  reff  0.5439550082
 4RecMu8                        7238  reff  0.4180673482
 ================ EVENT variables ================= 
 Events with VtxOK              7238    reff  1
 Events with 2 muonjets         5171     reff  0.714423874
 Events with 2 Dimuons          5170    reff  0.9998066138
 Events with 2DimVtxOK          5138    reff  0.9938104449
 Events with 2DimHitPix         1290     reff  0.2510704554
 Events with 2DimDzOK           1232   reff   0.9550387597
 Events with 2DimMassOK         1231  reff   0.9991883117
 Events with 2DimIsoOK          982   reff   0.7977254265
 Events with 2DimHLT            924   reff   0.9409368635
 ratio reco/gen                 0.5915492958 +/-  0.01243726193
Fake rate (#Fakes/#Events): 0.0001150592217
Filling fake stat vector: 
cT_string, cT_double    : 200_, 2
mass_string, mass_double: 0250, 0.25
ev_all                  : 147750
numFakes                : 17
There is a problem matching (dimuon 0)
There is a problem with no duplicate real_matching
There is a problem matching (dimuon 0)
There is a problem matching (dimuon 0)
There is a problem matching (dimuon 0)
There is a problem matching (dimuon 0)
There is a problem matching (dimuon 0)
There is a problem matching (dimuon 0)
There is a problem matching (dimuon 0)
There is a problem matching (dimuon 0)
There is a problem matching (dimuon 0)
There is a problem matching (dimuon 0)
There is a problem matching (dimuon 0)
There is a problem matching (dimuon 0)

 Sample: /fdata/hepx/store/user/bmichlin/DarkSUSY_mH_125_mGammaD_0250_cT_300_Evt_80k_13TeV_MG452_BR224_LHE_pythia8_GEN_SIM_MCRUN2_71_V1_v1/DarkSUSY_mH_125_mGammaD_0250_cT_300_Evt_80k_PATANA_APL_v12/160311_153836/Combined/
 Events          151250
 ================ GEN MUONS ========================================= 
 1GenMu17                       48720   reff 0.3221157025
 2GenMu8                        47638   reff  0.9777914614
 3GenMu8                        31844   reff  0.6684579537
 4GenMu8                        21363   reff  0.670864213
 4GenMu8 Lxy/Lz                 832   reff   0
 ================ RECO MUONS ========================================= 
 1RecMu17                       32180  reff  0.2127603306
 2RecMu8                        26739  reff  0.830919826
 3RecMu8                        12874  reff  0.4814690153
 4RecMu8                        4736  reff  0.3678732329
 ================ EVENT variables ================= 
 Events with VtxOK              4736    reff  1
 Events with 2 muonjets         3233     reff  0.6826435811
 Events with 2 Dimuons          3233    reff  1
 Events with 2DimVtxOK          3217    reff  0.9950510362
 Events with 2DimHitPix         715     reff  0.222256761
 Events with 2DimDzOK           684   reff   0.9566433566
 Events with 2DimMassOK         683  reff   0.9985380117
 Events with 2DimIsoOK          544   reff   0.7964860908
 Events with 2DimHLT            519   reff   0.9540441176
 ratio reco/gen                 0.6237980769 +/-  0.01679464616
Fake rate (#Fakes/#Events): 0.0001520661157
Filling fake stat vector: 
cT_string, cT_double    : 300_, 3
mass_string, mass_double: 0250, 0.25
ev_all                  : 151250
numFakes                : 23
There is a problem matching (dimuon 0)

 Sample: /fdata/hepx/store/user/bmichlin/DarkSUSY_mH_125_mGammaD_0250_cT_500_Evt_80k_13TeV_MG452_BR224_LHE_pythia8_GEN_SIM_MCRUN2_71_V1_v1/DarkSUSY_mH_125_mGammaD_0250_cT_500_Evt_80k_PATANA_APL_v12/160311_154223/Combined/
 Events          144250
 ================ GEN MUONS ========================================= 
 1GenMu17                       46554   reff 0.3227313692
 2GenMu8                        45550   reff  0.9784336469
 3GenMu8                        30403   reff  0.6674643249
 4GenMu8                        20414   reff  0.6714468967
 4GenMu8 Lxy/Lz                 267   reff   0
 ================ RECO MUONS ========================================= 
 1RecMu17                       23384  reff  0.1621074523
 2RecMu8                        18092  reff  0.7736914129
 3RecMu8                        6912  reff  0.3820473137
 4RecMu8                        2331  reff  0.3372395833
 ================ EVENT variables ================= 
 Events with VtxOK              2331    reff  1
 Events with 2 muonjets         1512     reff  0.6486486486
 Events with 2 Dimuons          1512    reff  1
 Events with 2DimVtxOK          1507    reff  0.9966931217
 Events with 2DimHitPix         235     reff  0.1559389516
 Events with 2DimDzOK           210   reff   0.8936170213
 Events with 2DimMassOK         209  reff   0.9952380952
 Events with 2DimIsoOK          169   reff   0.8086124402
 Events with 2DimHLT            158   reff   0.9349112426
 ratio reco/gen                 0.5917602996 +/-  0.03007979696
Fake rate (#Fakes/#Events): 2.079722704e-05
Filling fake stat vector: 
cT_string, cT_double    : 500_, 5
mass_string, mass_double: 0250, 0.25
ev_all                  : 144250
numFakes                : 3
There is a problem with no duplicate real_matching
There is a problem matching (dimuon 0)
There is a problem matching (dimuon 0)

 Sample: /fdata/hepx/store/user/bmichlin/DarkSUSY_mH_125_mGammaD_0250_cT_1000_Evt_80k_13TeV_MG452_BR224_LHE_pythia8_GEN_SIM_MCRUN2_71_V1_v1/DarkSUSY_mH_125_mGammaD_0250_cT_1000_Evt_80k_PATANA_APL_v12/160311_153212/Combined/
 Events          530130
 ================ GEN MUONS ========================================= 
 1GenMu17                       169884   reff 0.3204572463
 2GenMu8                        166091   reff  0.9776730004
 3GenMu8                        110974   reff  0.6681517963
 4GenMu8                        74458   reff  0.6709499522
 4GenMu8 Lxy/Lz                 258   reff   0
 ================ RECO MUONS ========================================= 
 1RecMu17                       52694  reff  0.0993982608
 2RecMu8                        36669  reff  0.6958856796
 3RecMu8                        9407  reff  0.2565382203
 4RecMu8                        2705  reff  0.2875518231
 ================ EVENT variables ================= 
 Events with VtxOK              2705    reff  1
 Events with 2 muonjets         1716     reff  0.6343807763
 Events with 2 Dimuons          1712    reff  0.9976689977
 Events with 2DimVtxOK          1699    reff  0.9924065421
 Events with 2DimHitPix         235     reff  0.1383166569
 Events with 2DimDzOK           213   reff   0.9063829787
 Events with 2DimMassOK         211  reff   0.9906103286
 Events with 2DimIsoOK          172   reff   0.8151658768
 Events with 2DimHLT            163   reff   0.9476744186
 ratio reco/gen                 0.6317829457 +/-  0.03002797502
Fake rate (#Fakes/#Events): 5.658989305e-06
Filling fake stat vector: 
cT_string, cT_double    : 1000, 10
mass_string, mass_double: 0250, 0.25
ev_all                  : 530130
numFakes                : 3
There is a problem matching (dimuon 0)
There is a problem matching (dimuon 0)
There is a problem matching (dimuon 0)
There is a problem matching (dimuon 0)
There is a problem matching (dimuon 0)

 Sample: /fdata/hepx/store/user/bmichlin/DarkSUSY_mH_125_mGammaD_0250_cT_2000_Evt_80k_13TeV_MG452_BR224_LHE_pythia8_GEN_SIM_MCRUN2_71_V1_v1/DarkSUSY_mH_125_mGammaD_0250_cT_2000_Evt_80k_PATANA_APL_v12/160311_153610/Combined/
 Events          600240
 ================ GEN MUONS ========================================= 
 1GenMu17                       191988   reff 0.3198520592
 2GenMu8                        187797   reff  0.9781705107
 3GenMu8                        125567   reff  0.6686315543
 4GenMu8                        84333   reff  0.6716175428
 4GenMu8 Lxy/Lz                 86   reff   0
 ================ RECO MUONS ========================================= 
 1RecMu17                       34681  reff  0.05777855524
 2RecMu8                        21847  reff  0.6299414665
 3RecMu8                        3756  reff  0.1719229185
 4RecMu8                        845  reff  0.2249733759
 ================ EVENT variables ================= 
 Events with VtxOK              845    reff  1
 Events with 2 muonjets         527     reff  0.6236686391
 Events with 2 Dimuons          527    reff  1
 Events with 2DimVtxOK          525    reff  0.9962049336
 Events with 2DimHitPix         80     reff  0.1523809524
 Events with 2DimDzOK           74   reff   0.925
 Events with 2DimMassOK         73  reff   0.9864864865
 Events with 2DimIsoOK          56   reff   0.7671232877
 Events with 2DimHLT            55   reff   0.9821428571
 ratio reco/gen                 0.6395348837 +/-  0.05177433326
Fake rate (#Fakes/#Events): 9.996001599e-06
Filling fake stat vector: 
cT_string, cT_double    : 2000, 20
mass_string, mass_double: 0250, 0.25
ev_all                  : 600240
numFakes                : 6
Info in <TCanvas::Print>: pdf file e_rec_alpha_gen_vs_cT_0250_GeV.pdf has been created

Fake Statistics
Mass (GeV)	cT (mm)	Num Events in Sample	Num Fakes in Sample
0.25	0	149500	0
0.25	0.05	147250	0
0.25	0.1	143250	7
0.25	0.2	151500	19
0.25	0.5	151250	69
0.25	1	148750	48
0.25	2	147750	17
0.25	3	151250	23
0.25	5	144250	3
0.25	10	530130	3
0.25	20	600240	6

